{
  "current_gate": "RUNTIME_ADAPTER",
  "current_state": "HOLD",
  "history": [
    {
      "state": "RECEIVED",
      "utc": "2026-10-02T22:02:00.228003+00:00"
    },
    {
      "state": "VALIDATED",
      "utc": "2026-10-02T22:02:00.228499+00:00"
    },
    {
      "state": "COMPILED",
      "utc": "2026-10-02T22:02:00.228503+00:00"
    },
    {
      "state": "SEMANTICALLY_EQUIVALENT_BY_BYTE_PRESERVATION",
      "utc": "2026-10-02T22:02:00.228505+00:00"
    },
    {
      "custosz_mission_id": "MIS-bfb8295767664143bd42",
      "state": "ROUTED",
      "utc": "2026-10-02T22:02:17.890710+00:00"
    },
    {
      "gate": "RUNTIME_ADAPTER",
      "reason": "NO_UNIQUE_PINNED_RUNTIME_ADAPTER",
      "state": "HOLD",
      "utc": "2026-10-02T22:02:17.890724+00:00"
    }
  ],
  "mail_id": "MAIL-293B2030898DFA7D046E",
  "mission_terminal_status": "HOLD",
  "root_blocker": "NO_UNIQUE_PINNED_RUNTIME_ADAPTER",
  "schema_version": "1.0",
  "workflow_technical_status": "PASS"
}
